language	compound	folder	images	sentence	type pred
Portuguese-Brazil	passar raspando	passar raspando	['61171783886.png', '24410753743.png', '10921910014.png', '96125930785.png', '30609887309.png']	Ele segurou a lâmina com firmeza, fazendo-a passar raspando pela corda sem cortá-la.	
Portuguese-Brazil	passar raspando	passar raspando	['61171783886.png', '24410753743.png', '10921910014.png', '96125930785.png', '30609887309.png']	No estadual, o clube do interior passou raspando no rebaixamento, ficando em segundo lugar no quadrangular da permanência	
Portuguese-Brazil	passar raspando	passar raspando	['61171783886.png', '24410753743.png', '10921910014.png', '96125930785.png', '30609887309.png']	O Governo obteve vitória estratégica com o projeto, mas o texto passou raspando, foram 53 votos a favor e 16 contra.	
Portuguese-Brazil	colírio para os olhos	colírio para os olhos	['21657350229.png', '95822511013.png', '87061815430.png', '25865794054.png', '95250272710.png']	Com um visual paradisíaco, o Caribe panamenho é um verdadeiro colírio para os olhos e para a alma, com suas águas azul-esverdeadas e coqueiros.	
Portuguese-Brazil	colírio para os olhos	colírio para os olhos	['21657350229.png', '95822511013.png', '87061815430.png', '25865794054.png', '95250272710.png']	Muitas vezes é um colírio para os olhos dos telespectadores ligar a televisão e se deparar com o elenco de O Outro Lado do Paraíso na tela.	
Portuguese-Brazil	colírio para os olhos	colírio para os olhos	['21657350229.png', '95822511013.png', '87061815430.png', '25865794054.png', '95250272710.png']	O colírio para os olhos serve para tratar diversas condições oculares, como alergias, ressecamento, inflamações e infecções.	
Portuguese-Brazil	colírio para os olhos	colírio para os olhos	['21657350229.png', '95822511013.png', '87061815430.png', '25865794054.png', '95250272710.png']	Os frascos de colírio para os olhos e remédios para os ouvidos são muito semelhantes.	
Portuguese-Brazil	que acorda com as galinhas	que acorda com as galinhas	['77131270636.png', '26510544390.png', '89436157424.png', '12526593937.png', '90317927297.png']	Analisando como seu relógio biológico funciona, você pode descobrir se é da turma que acorda com as galinhas ou se vira a noite com as corujas.	
Portuguese-Brazil	que acorda com as galinhas	que acorda com as galinhas	['77131270636.png', '26510544390.png', '89436157424.png', '12526593937.png', '90317927297.png']	Durante o acampamento rural, os meninos acordaram com as galinhas bicando a palha do chão.	
Portuguese-Brazil	que acorda com as galinhas	que acorda com as galinhas	['77131270636.png', '26510544390.png', '89436157424.png', '12526593937.png', '90317927297.png']	Ele dormiu na fazenda e acordou com as galinhas cantando ao seu redor.	
Portuguese-Brazil	que acorda com as galinhas	que acorda com as galinhas	['77131270636.png', '26510544390.png', '89436157424.png', '12526593937.png', '90317927297.png']	Enquanto pede mais cinco minutinhos de sono pela manhã, a turma que acorda com as galinhas já levantou, tomou café e começou o dia.	
Portuguese-Brazil	berço de ouro	berço de ouro	['62033804389.png', '39980827571.png', '96355156356.png', '34460300453.png', '62554342794.png']	A maioria das pessoas acha que quando uma criança nasce em berço de ouro, dificilmente precisa se esforçar para algo, mas há exceções.	
Portuguese-Brazil	berço de ouro	berço de ouro	['62033804389.png', '39980827571.png', '96355156356.png', '34460300453.png', '62554342794.png']	Eles nasceram em berço de ouro, mas eu nasci pobre, sempre que queria alguma coisa, tinha que ajudar em casa para ganhar.	
Portuguese-Brazil	berço de ouro	berço de ouro	['62033804389.png', '39980827571.png', '96355156356.png', '34460300453.png', '62554342794.png']	O museu exibia um antigo berço de ouro usado por uma família real do século XVIII.	
Portuguese-Brazil	berço de ouro	berço de ouro	['62033804389.png', '39980827571.png', '96355156356.png', '34460300453.png', '62554342794.png']	Para celebrar o nascimento do herdeiro, a família encomendou um berço de ouro adornado com pedras preciosas.	
Portuguese-Brazil	prova de fogo	prova de fogo	['67078988996.png', '67435258743.png', '48999859502.png', '33117578478.png', '55246640631.png']	A imprensa espanhola descreve o julgamento como uma prova de fogo para a democracia do país, naquele que é considerado o maior evento jurídico desde o fim da ditadura franquista, em 1976.	
Portuguese-Brazil	prova de fogo	prova de fogo	['67078988996.png', '67435258743.png', '48999859502.png', '33117578478.png', '55246640631.png']	Depois de mais uma prova de fogo para a resistência dos foliões, foram todos convidados para comer feijoada na Rua Bertioga, onde mora a sobrinha de Batata e atual presidente do bloco, Fátima Araújo.	
Portuguese-Brazil	prova de fogo	prova de fogo	['67078988996.png', '67435258743.png', '48999859502.png', '33117578478.png', '55246640631.png']	No treinamento dos bombeiros, a última etapa era uma prova de fogo, em que era preciso atravessar o corredor em chamas controladas usando o equipamento completo.	
Portuguese-Brazil	prova de fogo	prova de fogo	['67078988996.png', '67435258743.png', '48999859502.png', '33117578478.png', '55246640631.png']	Os arqueólogos reconstituíram uma antiga prova de fogo, em que as ferramentas de pedra eram expostas ao calor para aumentar sua resistência.	
Portuguese-Brazil	tempestade em copo dágua	tempestade em copo dágua	['48834787809.png', '93135421182.png', '28026075769.png', '17506798901.png', '79484623819.png']		
Portuguese-Brazil	caixa preta	caixa preta	['38789783040.png', '76215666728.png', '74018958455.png', '51971345498.png', '15889422442.png']		
Portuguese-Portugal	treinador de bancada	treinador de bancada	['67360799200.png', '19516183718.png', '28266198709.png', '74826044039.png', '14817162227.png']	No entanto, é crucial entender que os treinadores de bancada não têm a mesma perspetiva e conhecimento que os treinadores profissionais têm.	
Portuguese-Portugal	treinador de bancada	treinador de bancada	['67360799200.png', '19516183718.png', '28266198709.png', '74826044039.png', '14817162227.png']	O futebol é um desporto que causa entusiasmo e, na realidade, em cada pai/adepto pode aparecer um verdadeiro treinador de bancada.	
Portuguese-Portugal	treinador de bancada	treinador de bancada	['67360799200.png', '19516183718.png', '28266198709.png', '74826044039.png', '14817162227.png']	Os treinadores de bancada da justiça ou de processos podem causar um mal maior do que os que se digladiam no dia seguinte sobre o jogo da véspera.	
Portuguese-Portugal	treinador de bancada	treinador de bancada	['67360799200.png', '19516183718.png', '28266198709.png', '74826044039.png', '14817162227.png']	Portugal parece ter encontrado um novo tema para treinadores de bancada: a Grécia.	
Portuguese-Portugal	beco sem saída	beco sem saída	['35834825743.png', '45397293035.png', '23018037077.png', '54758776435.png', '14537889193.png']	Esta Assembleia e o Governo concluem que o actual sistema político e económico é um beco sem saída e uma marcha para o abismo sem hipótese de regresso.	
Portuguese-Portugal	beco sem saída	beco sem saída	['35834825743.png', '45397293035.png', '23018037077.png', '54758776435.png', '14537889193.png']	Situada num beco sem saída, a propriedade fica perto de tudo, a 5 minutos de Loulé e a 10 minutos do aeroporto.	
Portuguese-Portugal	beco sem saída	beco sem saída	['35834825743.png', '45397293035.png', '23018037077.png', '54758776435.png', '14537889193.png']	Vivenda privada com 6 quartos e 7 casas de banho, localizada num beco sem saída, sem carros de passagem.	
Portuguese-Portugal	beco sem saída	beco sem saída	['35834825743.png', '45397293035.png', '23018037077.png', '54758776435.png', '14537889193.png']	É evidente que se está a tentar empurrar a classe operária e os trabalhadores deste país para uma situação de impasse e de beco sem saída, de que os trabalhadores serão as primeiras vítimas.	
Portuguese-Portugal	prémio da academia	prémio da academia	['33935218745.png', '68410279405.png', '72059456335.png', '67608627557.png', '87116786721.png']	Os prémios da Academia de Cinema de Hollywood, aqueles que todos conhecemos como “Óscares”, serão possivelmente a maior consagração dentro da indústria cinematográfica à escala mundial.	
Portuguese-Portugal	prémio da academia	prémio da academia	['33935218745.png', '68410279405.png', '72059456335.png', '67608627557.png', '87116786721.png']	Pela primeira vez, há um projeto português nomeado para o prémio da Academia	
Portuguese-Portugal	prémio da academia	prémio da academia	['33935218745.png', '68410279405.png', '72059456335.png', '67608627557.png', '87116786721.png']	Souto Moura vence prémio da Academia Americana de Artes e Letras.	
Portuguese-Portugal	prémio da academia	prémio da academia	['33935218745.png', '68410279405.png', '72059456335.png', '67608627557.png', '87116786721.png']	«A Viagem», de Henrique Lopes, foi considerada a Melhor Curta-Metragem Experimental nos Prémios Sophia Estudante 2019 um prémio da Academia Portuguesa de Cinema.	
Portuguese-Portugal	mar de rosas	mar de rosas	['28791767659.png', '19868640539.png', '11762373814.png', '23184747504.png', '76777875198.png']	As pétalas foram arrastadas pelo vento para o rio e formaram um mar de rosas.	
Portuguese-Portugal	mar de rosas	mar de rosas	['28791767659.png', '19868640539.png', '11762373814.png', '23184747504.png', '76777875198.png']	Julia Roberts descobre que afinal a sua vida não era um mar de rosas, ao descobrir o marido nos braços de outra.	
Portuguese-Portugal	mar de rosas	mar de rosas	['28791767659.png', '19868640539.png', '11762373814.png', '23184747504.png', '76777875198.png']	Porém, se muitos passos têm sido dados no sentido da transformação da região, que não se fique a pensar que Viseu é um «mar de rosas», pois muitas carências se mantêm, às quais urge fazer face de forma frontal.	
Portuguese-Portugal	mar de rosas	mar de rosas	['28791767659.png', '19868640539.png', '11762373814.png', '23184747504.png', '76777875198.png']	Um mar de rosas estendia-se à nossa frente, no lago, depois da tempestade violenta que destruíra o jardim.	
Portuguese-Portugal	advogado do diabo	advogado do diabo	['36731451407.png', '91697914030.png', '53196844656.png', '67058712969.png', '13442509732.png']	Dito isto e em modo de advogado do diabo, a noção é que as legislativas de 2025 são um termo de comparação muito mais fiável do que as autárquicas de 2021.	
Portuguese-Portugal	advogado do diabo	advogado do diabo	['36731451407.png', '91697914030.png', '53196844656.png', '67058712969.png', '13442509732.png']	O tribunal fez de 'advogado do diabo', ao confrontar vários pilotos examinadores e instrutores sobre o que poderia ter sido feito de diferente, mas nada se provou nesse sentido.	
Portuguese-Portugal	advogado do diabo	advogado do diabo	['36731451407.png', '91697914030.png', '53196844656.png', '67058712969.png', '13442509732.png']	Por isso, existe o Advogado do Diabo, que garante que todas as informações sobre o candidato a santo foram esmiuçadas, de modo a não existirem erros ou pontas soltas.	
Portuguese-Portugal	advogado do diabo	advogado do diabo	['36731451407.png', '91697914030.png', '53196844656.png', '67058712969.png', '13442509732.png']	Posteriormente, toda a documentação passa pela consulta de teólogos e tudo é crivado pelo promotor da Fé, popularmente designado por “advogado do diabo”.	
Portuguese-Portugal	alhos com bugalhos	alhos com bugalhos	['95861342365.png', '48785787550.png', '83780818521.png', '34218140366.png', '37781599814.png']	Ela confundiu os alhos com bugalhos e deitou-os fora.	
Portuguese-Portugal	alhos com bugalhos	alhos com bugalhos	['95861342365.png', '48785787550.png', '83780818521.png', '34218140366.png', '37781599814.png']	Misturei alhos com bugalhos num saco para levar para casa.	
Portuguese-Portugal	alhos com bugalhos	alhos com bugalhos	['95861342365.png', '48785787550.png', '83780818521.png', '34218140366.png', '37781599814.png']	Mário Nogueira, secretário-geral da FENPROF expõe a situação real, com números reais, comparando o que é comparável e não misturando alhos com bugalhos.	
Portuguese-Portugal	alhos com bugalhos	alhos com bugalhos	['95861342365.png', '48785787550.png', '83780818521.png', '34218140366.png', '37781599814.png']	Um restaurante onde se quer almoçar todos os dias, pode ser ótimo, mas o NOMA é outra coisa e seria comparar alhos com bugalhos.	
Portuguese-Portugal	coração de pedra	coração de pedra	['42183441424.png', '50849733978.png', '73005718502.png', '80123554876.png', '35263747129.png']	A Suíça parece ter um coração de pedra, mas, no fundo, só deseja evitar ser transformada num centro de atracção para os argelinos.	
Portuguese-Portugal	coração de pedra	coração de pedra	['42183441424.png', '50849733978.png', '73005718502.png', '80123554876.png', '35263747129.png']	A campa tinha um lindo coração de pedra dedicado pelos filhos.	
Portuguese-Portugal	coração de pedra	coração de pedra	['42183441424.png', '50849733978.png', '73005718502.png', '80123554876.png', '35263747129.png']	As flores artificiais vão ser substituídas por outras, naturais, e pensa também colocar na sepultura um coração de pedra.	
Portuguese-Portugal	coração de pedra	coração de pedra	['42183441424.png', '50849733978.png', '73005718502.png', '80123554876.png', '35263747129.png']	Wilde dizia que só uma pessoa com um coração de pedra não ria às gargalhadas com Charles Dickens.	
Portuguese-Portugal	marcar pontos	marcar pontos	['91846430012.png', '27673036492.png', '14631082700.png', '28586851629.png', '37726624631.png']	Fica-lhe bem , Sr. Deputado Rui Rio, dá-lhe currículo, permite-lhe eventualmente marcar pontos face às picardias do Sr. Secretário de Estado Luís Filipe Menezes.	
Portuguese-Portugal	marcar pontos	marcar pontos	['91846430012.png', '27673036492.png', '14631082700.png', '28586851629.png', '37726624631.png']	Manda a verdade que se reconheça ser a cooperação uma área em que o Governo se apura, com resultados concretos, em marcar pontos a seu favor.	
Portuguese-Portugal	marcar pontos	marcar pontos	['91846430012.png', '27673036492.png', '14631082700.png', '28586851629.png', '37726624631.png']	Os Grizzlies, a mais fraca formação da NBA, tiveram, além da fulgurante exibição de Greg Anthony, em Byron Scott o jogador precioso a marcar pontos nos últimos segundos.	
Portuguese-Portugal	marcar pontos	marcar pontos	['91846430012.png', '27673036492.png', '14631082700.png', '28586851629.png', '37726624631.png']	Visivelmente melhor organizado em termos ofensivos, o Guialmi Estrelas aproveitou a ineficácia defensiva dos adversários, com Kenny Turner a penetrar à vontade e a marcar pontos atrás de pontos.	
Portuguese-Portugal	maçã podre	maçã podre	['47758169962.png', '77212510257.png', '51272630581.png', '60343244794.png', '43887625221.png']	Apesar de uma maçã podre poder contaminar as outras com as quais está em contacto, isso demora tempo.	
Portuguese-Portugal	maçã podre	maçã podre	['47758169962.png', '77212510257.png', '51272630581.png', '60343244794.png', '43887625221.png']	Não esqueçamos, por outro lado, que o orçamento deste ano foi uma autêntica maçã podre.	
Portuguese-Portugal	maçã podre	maçã podre	['47758169962.png', '77212510257.png', '51272630581.png', '60343244794.png', '43887625221.png']	Os quatro anos de sacrifícios podem ser postos em causa por uma maçã podre que assusta os mercados e nos fazem regressar para trás.	
Portuguese-Portugal	maçã podre	maçã podre	['47758169962.png', '77212510257.png', '51272630581.png', '60343244794.png', '43887625221.png']	Provavelmente, já ouviu o ditado popular ‘maçã podre estraga a companheira’ e a explicação é química, já que a maçã liberta tanto etileno que provoca o amadurecimento de outras frutas que estejam próximas.	
Portuguese-Portugal	banho de água fria	banho de água fria	['25839832742.png', '51784167398.png', '90618989568.png', '73834738740.png', '54083058847.png']	Desmaiou após um banho de água fria, a única disponível.	
Portuguese-Portugal	banho de água fria	banho de água fria	['25839832742.png', '51784167398.png', '90618989568.png', '73834738740.png', '54083058847.png']	Ele estava feliz e leve como se acabasse de tomar banho de água fria.	
Portuguese-Portugal	banho de água fria	banho de água fria	['25839832742.png', '51784167398.png', '90618989568.png', '73834738740.png', '54083058847.png']	Estes resultados constituem um verdadeiro banho de água fria para a Liga.	
Portuguese-Portugal	banho de água fria	banho de água fria	['25839832742.png', '51784167398.png', '90618989568.png', '73834738740.png', '54083058847.png']	Na sexta-feira os resultados decepcionantes da Microsoft e operações de liquidação de contratos de opções deram um autêntico banho de água fria à praça, que depressa deixou fugir o recorde.	
Portuguese-Portugal	pedra no sapato	pedra no sapato	['32852207674.png', '29783869163.png', '33220889915.png', '11853861648.png', '85174709989.png']	A pedra no sapato criou um calo que a magoava quando andava.	
Portuguese-Portugal	pedra no sapato	pedra no sapato	['32852207674.png', '29783869163.png', '33220889915.png', '11853861648.png', '85174709989.png']	A única pedra no sapato da coligação era o facto do município pertencer, no momento, ao PSD.	
Portuguese-Portugal	pedra no sapato	pedra no sapato	['32852207674.png', '29783869163.png', '33220889915.png', '11853861648.png', '85174709989.png']	Andou o dia todo com uma pedra no sapato sem a conseguir tirar.	
Portuguese-Portugal	pedra no sapato	pedra no sapato	['32852207674.png', '29783869163.png', '33220889915.png', '11853861648.png', '85174709989.png']	É o mais mediático movimento social do Brasil e tem sido uma pedra no sapato dos governos de Brasília.	
Portuguese-Portugal	olho de gato	olho de gato	['58908845839.png', '44129303275.png', '95817551220.png', '59481931264.png', '10939057441.png']	A pupila de um olho de gato reduz-se a uma fenda vertical de largura 0 mm à luz do dia.	
Portuguese-Portugal	olho de gato	olho de gato	['58908845839.png', '44129303275.png', '95817551220.png', '59481931264.png', '10939057441.png']	Estas lentes de contacto imitam a forma invulgar da pupila preta de um olho de gato sobre um fundo branco.	
Portuguese-Portugal	olho de gato	olho de gato	['58908845839.png', '44129303275.png', '95817551220.png', '59481931264.png', '10939057441.png']	Os olhos de gato fotoluminescentes e refletivos combinam duas propriedades no sentido de oferecer um máximo de visibilidade e eficácia.	
Portuguese-Portugal	olho de gato	olho de gato	['58908845839.png', '44129303275.png', '95817551220.png', '59481931264.png', '10939057441.png']	Os olhos de gato proporcionam aos condutores uma melhor identificação da faixa de rodagem e uma utilização muito versátil.	
Portuguese-Portugal	ato de deus	ato de deus	['12861399651.png', '37629158976.png', '27901894194.png', '93307649858.png', '88710920084.png']	A Criação é o ato de Deus que deu origem a tudo o que existe, trazendo todas as coisas à existência a partir do nada.	
Portuguese-Portugal	ato de deus	ato de deus	['12861399651.png', '37629158976.png', '27901894194.png', '93307649858.png', '88710920084.png']	Deste modo, os atos de Jesus têm força divina de salvação: por serem atos de Deus, são causa de graça.	
Portuguese-Portugal	ato de deus	ato de deus	['12861399651.png', '37629158976.png', '27901894194.png', '93307649858.png', '88710920084.png']	Esta crise é um acto de Deus, completamente fora de controlo das companhias.	
Portuguese-Portugal	ato de deus	ato de deus	['12861399651.png', '37629158976.png', '27901894194.png', '93307649858.png', '88710920084.png']	No caso de lhe ser cobrado um não cancelamento, devido a um evento de força maior, incluindo mas não se limitando, a um qualquer ato de Deus, terrorismo, ato do Governo ou de Estado, guerra civil, insurreição, embargo ou trabalho litigioso, terá direito a uma restituição.	
Portuguese-Portugal	mercado em alta	mercado em alta	['41961052723.png', '43976472739.png', '74431714518.png', '17223558696.png', '72638459933.png']	Num mercado em alta, os bancos ganham em vários tabuleiros e se quiserem impressionar nos lucros basta alienar uma boa parte da sua carteira de acções.	
Portuguese-Portugal	mercado em alta	mercado em alta	['41961052723.png', '43976472739.png', '74431714518.png', '17223558696.png', '72638459933.png']	Sobretudo porque, novas descidas nas taxas de juro, uma medida tida como essencial para sustentar o mercado em alta, não eram confirmadas pelas autoridades monetárias norte-americanas.	
Portuguese-Portugal	sapo na garganta	sapo na garganta	['71359014897.png', '28276524871.png', '89768805162.png', '51359703731.png', '94442608571.png']	A cobra que apanhámos ontem tinha um sapo na garganta.	
Portuguese-Portugal	sapo na garganta	sapo na garganta	['71359014897.png', '28276524871.png', '89768805162.png', '51359703731.png', '94442608571.png']	Hoje acordei com um sapo na garganta e tossi o dia todo.	
Portuguese-Portugal	sapo na garganta	sapo na garganta	['71359014897.png', '28276524871.png', '89768805162.png', '51359703731.png', '94442608571.png']	O falcão aproximou-se silenciosamente e levantou voo com um sapo na garganta.	
Portuguese-Portugal	sapo na garganta	sapo na garganta	['71359014897.png', '28276524871.png', '89768805162.png', '51359703731.png', '94442608571.png']	Sentia um sapo na garganta e acabei por ser diagnosticado com uma faringite.	
Portuguese-Portugal	por um triz	por um triz	['39917827122.png', '91176431020.png', '98647488084.png', '20397044584.png', '12163732859.png']	Só falhou com a tricampeã mundial Dinamarca e agora perdeu por um triz com a campeã da Europa.	
Portuguese-Portugal	por um triz	por um triz	['39917827122.png', '91176431020.png', '98647488084.png', '20397044584.png', '12163732859.png']	Um idoso escapou, por um triz, a ser trucidado por um comboio, ao atravessar uma passagem de nível cujas cancelas estavam fechadas.	
Portuguese-Portugal	pé de meia	pé de meia	['77629101285.png', '62108373675.png', '61763974448.png', '15786004479.png', '63168128297.png']		
Portuguese-Portugal	fuga de cérebros	fuga de cérebros	['31469175248.png', '46583224027.png', '72184499936.png', '60930127773.png', '20874096132.png']	A fuga de cérebros das carreiras universitárias e de investigação ,quer para o estrangeiro, quer para os sectores público e privado nacionais, requer a adopção de uma verdadeira política de Estado, norteadora do nosso futuro colectivo que se deseja digno e próspero.	
Portuguese-Portugal	fuga de cérebros	fuga de cérebros	['31469175248.png', '46583224027.png', '72184499936.png', '60930127773.png', '20874096132.png']	A fuga de cérebros é inevitável e é o futuro da ciência em França que está ameaçado.	
Portuguese-Portugal	fuga de cérebros	fuga de cérebros	['31469175248.png', '46583224027.png', '72184499936.png', '60930127773.png', '20874096132.png']	Quando os alunos falham todas as perguntas do teste, sinto que houve uma fuga de cérebros.	
Portuguese-Portugal	fuga de cérebros	fuga de cérebros	['31469175248.png', '46583224027.png', '72184499936.png', '60930127773.png', '20874096132.png']	Sempre que o tema é a matemática os alunos ficam ausentes e parece que estou a presenciar uma fuga de cérebros.	
Portuguese-Portugal	relógio biológico	relógio biológico	['77356987551.png', '64370280935.png', '12807698276.png', '36489092059.png', '83429263042.png']	A actriz está a sentir o tic-tac do relógio biológico e resolveu ter um filho enquanto é tempo.	
Portuguese-Portugal	relógio biológico	relógio biológico	['77356987551.png', '64370280935.png', '12807698276.png', '36489092059.png', '83429263042.png']	Antes da invenção da electricidade, o homem seguia o ritmo da natureza e o relógio biológico para dormir.	
Portuguese-Portugal	relógio biológico	relógio biológico	['77356987551.png', '64370280935.png', '12807698276.png', '36489092059.png', '83429263042.png']	"Físicos e biólogos desenvolvem métodos para investigar não só os mecanismos de orientação de algumas aves mas o fenómeno que faz cada espécie ""sentir"" o momento da migração, falando-se de um relógio biológico acionado  por qualquer hormona produzida à custa da acumulação de energia solar."	
Portuguese-Portugal	relógio biológico	relógio biológico	['77356987551.png', '64370280935.png', '12807698276.png', '36489092059.png', '83429263042.png']	"Mas, para além da infertilidade, Mário de Sousa refere a ""maior tendência para o aborto , os nados-mortos e ocorrência de síndroma de Down"", especialmente acima dos 37 anos, em que, afirma, há uma espécie de ""regressão do relógio biológico feminino""."	
Portuguese-Portugal	coração de manteiga	coração de manteiga	['78181843516.png', '79756029874.png', '21063027363.png', '35370847158.png', '13965446854.png']	Além disso, o butirro tem uma crosta fina e brilhante, que contém um coração de manteiga mais ou menos leve, dependendo do tempo de cura.	
Portuguese-Portugal	coração de manteiga	coração de manteiga	['78181843516.png', '79756029874.png', '21063027363.png', '35370847158.png', '13965446854.png']	Isto não quer dizer que não seja uma pessoa romântica, pois até te posso dizer que sou um coração de manteiga.	
