language	compound	folder	images	sentence	type pred
Serbian	звона и прапорци	звона и прапорци	['75745902588.png', '91199952177.png', '47686609812.png', '70942605685.png', '84922798903.png']	Мала звона и прапорци присутни су у Русији још од архајских времена; у гробовима Скита који су некада насељавали руске степе прона­лазимо брончана звона, врло слична онима која су касније украшавала руске тројке	
Serbian	звона и прапорци	звона и прапорци	['75745902588.png', '91199952177.png', '47686609812.png', '70942605685.png', '84922798903.png']	Прослављени филмски и телевизијски сценариста Синиша Павиц́, добитник Доситејеве награде за животно дело, оценио је да смо данас свакодневно са ТВ екрана засути варварством, док истовремено, звона и прапорци заглушују гласове разума.	
Serbian	слијепа улица	слијепа улица	['85833003904.png', '72762523044.png', '79485338180.png', '69158752527.png', '17468234741.png']	Напокон, пронађу црну грдосију, потпуно осамљену у слијепој улици.	
Serbian	слијепа улица	слијепа улица	['85833003904.png', '72762523044.png', '79485338180.png', '69158752527.png', '17468234741.png']	Привиђење није отклон од стварности, погрешан ток реалности, слијепа улица живота, већ је оно надопуна стварности.	
Serbian	слијепа улица	слијепа улица	['85833003904.png', '72762523044.png', '79485338180.png', '69158752527.png', '17468234741.png']	Том уском слијепом улицом, ђе нема народа, изашо сам на отворену широку чаршију, доле према Народном музеју, ђе се крижају путеви и пруге од трамваја.	
Serbian	слијепа улица	слијепа улица	['85833003904.png', '72762523044.png', '79485338180.png', '69158752527.png', '17468234741.png']	Физика се сада опет нашла у слијепој улици; у сваком случају , она је за мене претешка и ја бих више волио бити филмски комичар или нешто слично томе, и више ништа не слушати о физици!	
Serbian	меко срце	меко срце	['96413907837.png', '91143545541.png', '30297499472.png', '82893171620.png', '25662110438.png']	Ако је по томе, Трифуне, ја баш имам меко срце; цео свет зна да ја имам меко срце, па ето ја не плачем.	
Serbian	меко срце	меко срце	['96413907837.png', '91143545541.png', '30297499472.png', '82893171620.png', '25662110438.png']	Колико твоји зуби у меко срце дрвета засијецају толико боли.	
Serbian	меко срце	меко срце	['96413907837.png', '91143545541.png', '30297499472.png', '82893171620.png', '25662110438.png']	Ових дана прича о меком срцу ММФ-а поново је актуелизована њиховим захтевом да се укине закон о привременом умањењу пензија.	
Serbian	меко срце	меко срце	['96413907837.png', '91143545541.png', '30297499472.png', '82893171620.png', '25662110438.png']	У глави, грудима и трбуху налазе се мекани унутрашњи делови тела, који служе као органи за храњење, за крвоток, за осећање и за дисање, те и пчеле имају и срце и крв.	
Serbian	акције скачу	акције скачу	['39582536567.png', '76288723201.png', '36405126965.png', '28698444645.png', '64766817375.png']	"Кад се шеик најави, акције скачу, најављени долазак арапске компаније ""Ал Равафед"" у Сивац повисио је цену акција пољопривредног комбината ""Бачка"" на 6.358,95 динара."	
Serbian	акције скачу	акције скачу	['39582536567.png', '76288723201.png', '36405126965.png', '28698444645.png', '64766817375.png']	У њој су описани очајни кораци учињени од стране Замфирових на све стране, а највише око Мана, коме су у последње време акције почеле нагло скакати	
Serbian	акције скачу	акције скачу	['39582536567.png', '76288723201.png', '36405126965.png', '28698444645.png', '64766817375.png']	Шта више, у доба скупоће, њине акције скачу не само релативно него и апсолутно, тј. што мање женидаба између момака и девојака, то више измеђ удоваца и удовица.	
Serbian	акције скачу	акције скачу	['39582536567.png', '76288723201.png', '36405126965.png', '28698444645.png', '64766817375.png']	Што је већа потражња за акцијама, акције скачу.	
Serbian	прва виолина	прва виолина	['74253992906.png', '86788818740.png', '98158945883.png', '41792500886.png', '66923996335.png']	Кажу да је прву виолину израдио кад му је било тринаест година.	
Serbian	прва виолина	прва виолина	['74253992906.png', '86788818740.png', '98158945883.png', '41792500886.png', '66923996335.png']	Мој отац је обавио размену, и тако сам добио прву виолину.	
Serbian	прва виолина	прва виолина	['74253992906.png', '86788818740.png', '98158945883.png', '41792500886.png', '66923996335.png']	Нећу и не треба да, као сценограф, будем прва виолина представе, редитељ је тај који све координира, реализовању његовеза мисли треба да служи и моје стваралаштво.	
Serbian	прва виолина	прва виолина	['74253992906.png', '86788818740.png', '98158945883.png', '41792500886.png', '66923996335.png']	Само малобројни остају прве виолине до краја.	
Serbian	ђавољи адвокат	ђавољи адвокат	['88644931391.png', '47485045033.png', '29243310204.png', '91363994186.png', '31904876974.png']	"Док је грофица Панова, иако не може знати за њих, Нађи ""осигурала пријем, код једног чувеног лекара, гинеколога"", јер ђаво ипак зна за ту тајну помисао, можда ју је он чак и дошапнуо, кад је ђавољи адвокат, посредно јој помогавши да роди дете."	
Serbian	ђавољи адвокат	ђавољи адвокат	['88644931391.png', '47485045033.png', '29243310204.png', '91363994186.png', '31904876974.png']	Иако је тадашњи папа био укинуо чувену канцеларију “ђавољег адвоката”, како би лакше канонизовао огроман број нових “светаца”, црква је и даље била обавезна да тражи сведочење од критичара, па сам се ја ту нашао као представник ђавола и то, како се испоставило, про боно.	
Serbian	ђавољи адвокат	ђавољи адвокат	['88644931391.png', '47485045033.png', '29243310204.png', '91363994186.png', '31904876974.png']	Израз “Ђавољи адвокат“, или у оригиналу “Advocato Diabolo “ је колоквијални назив за формалну позицију унутар католичке цркве под називом “Promotor Fidei”.	
Serbian	ђавољи адвокат	ђавољи адвокат	['88644931391.png', '47485045033.png', '29243310204.png', '91363994186.png', '31904876974.png']	Овај буџет је изгледа правио ђавољи адвокат.	
Serbian	упирати прстом	упирати прстом	['88404901054.png', '24266555449.png', '86157381981.png', '47463414589.png', '13037569414.png']	Једаред обућар окрете главу ка жени и диже прст, а на то се њене обрве јаче узвише, очи боље засјаше, те упре прстом у неку реч и застаде.	
Serbian	упирати прстом	упирати прстом	['88404901054.png', '24266555449.png', '86157381981.png', '47463414589.png', '13037569414.png']	Из аутомобила су искочили наоружани људи и захтевали од нас да кажемо шта радимо – један је прстом упирао у ознаку ТВ на колима.	
Serbian	упирати прстом	упирати прстом	['88404901054.png', '24266555449.png', '86157381981.png', '47463414589.png', '13037569414.png']	Када је о „пречишћавању“ језика ријеч, Новаковић је у првом реду упирао прстом у кованице, старе и нове позајмљенице из страних језика (исп. Белић 1959: X).	
Serbian	упирати прстом	упирати прстом	['88404901054.png', '24266555449.png', '86157381981.png', '47463414589.png', '13037569414.png']	Хоћемо ли вечито упирати прстом на нехат и немар наш?	
Serbian	свакој тици кобац	свакој тици кобац	['99474269794.png', '85593631788.png', '70565360456.png', '37302561048.png', '29572130030.png']	"А кад који почне са моралног гледишта о цели човечијег живота мудровати, у очи истину говорити, пороке осуђивати, неправичности исправљати и свакој тици кобац бити, то ти је онда други ""Дон Гихоте"", који против дивова и ветрењача војује."	
Serbian	свакој тици кобац	свакој тици кобац	['99474269794.png', '85593631788.png', '70565360456.png', '37302561048.png', '29572130030.png']	Кобац је птица грабљивица Accipiter nisus која напада друге птице, кокоши, мишеве.	
Serbian	свакој тици кобац	свакој тици кобац	['99474269794.png', '85593631788.png', '70565360456.png', '37302561048.png', '29572130030.png']	Кобац је једна од наших најмањих грабљивица, а његов плен су углавном врапци и птице величине од сенице до коса.	
Serbian	свакој тици кобац	свакој тици кобац	['99474269794.png', '85593631788.png', '70565360456.png', '37302561048.png', '29572130030.png']	Сва је прилика да не бих толико узлетао у висине живота, већ ако не бих да будем „свакој тици кобац“, колико у дубине му, тражећи бездану дно, јер с пуним тобоцем лакше се рони.	
Serbian	банана република	банана република	['61184435982.png', '18197099110.png', '64973051106.png', '50586173709.png', '38023767007.png']	Један од највећих извозника банана је Еквадор, који на светско тржиште пласира трећину од 117 милиона тона укупних количина овог воћа, а после кажу да смо ми ''банана република''?!	
Serbian	банана република	банана република	['61184435982.png', '18197099110.png', '64973051106.png', '50586173709.png', '38023767007.png']	Дугорочније гледано, ми више нећемо само носити мајице Банана Република, већ ћемо живети у банана републикама.	
Serbian	банана република	банана република	['61184435982.png', '18197099110.png', '64973051106.png', '50586173709.png', '38023767007.png']	Међутим, ако се величина државе цени по политици која штити националне интересе, онда је Русија те (1994) године била ближе банана републици него великој држави.	
Serbian	банана република	банана република	['61184435982.png', '18197099110.png', '64973051106.png', '50586173709.png', '38023767007.png']	Шпијунске мреже банана-република и Скотланд Јарда.	
Serbian	клецање кољена	клецање кољена	['58513842124.png', '61765402071.png', '76246522270.png', '30003228614.png', '81737110690.png']		
Serbian	потпуна слика	потпуна слика	['65628979196.png', '36822055244.png', '74971061712.png', '99428693494.png', '94477591236.png']	Sad je slika potpuna,   Goran i Dragoljub Peković RADE.	
Serbian	потпуна слика	потпуна слика	['65628979196.png', '36822055244.png', '74971061712.png', '99428693494.png', '94477591236.png']	На крају би додао јоште одјељак за српску књижевност, и овому дијелу требало би обратити особиту бригу, јер он треба да је ни мање ни више   него потпуна слика онога што бива у данашњој књижевности.	
Serbian	потпуна слика	потпуна слика	['65628979196.png', '36822055244.png', '74971061712.png', '99428693494.png', '94477591236.png']	Потпуна спика изоклина настаје при ротацији у интервалу од 0° до 90°, те збирну слику добивамо цртајући све те изоклине на заједничком цртежу.	
Serbian	потпуна слика	потпуна слика	['65628979196.png', '36822055244.png', '74971061712.png', '99428693494.png', '94477591236.png']	Стручни разговори са вашим запосленима су ми помогли да стекнем слику, потпуну слику о ИТ Академији, како она функционише, шта могу да научим...	
Serbian	обешени колачи	обешени колачи	['72668072193.png', '46494510126.png', '53367371242.png', '79358773793.png', '44232438784.png']	Дивљач, која се је доносила на астал помазивана је амбром и мукусом, кајгане посипане су не шећером, већ ситним драгим камењем, за посластице пуштане су мале птице, и на ногама њиховим обешени су били колачи: на последку пуштали су јастребове, који су научени били да лове.	
Serbian	обешени колачи	обешени колачи	['72668072193.png', '46494510126.png', '53367371242.png', '79358773793.png', '44232438784.png']	Ко се заноси одласком у иностранство, нека буде сигуран да га у иностранству неће чекати „обешени колачи“.	
Serbian	обешени колачи	обешени колачи	['72668072193.png', '46494510126.png', '53367371242.png', '79358773793.png', '44232438784.png']	На сеоској слави, колачи у облику плетеница и срца били су обешени на украсне гране изнад стола као део традиционалног декора.	
Serbian	обешени колачи	обешени колачи	['72668072193.png', '46494510126.png', '53367371242.png', '79358773793.png', '44232438784.png']	От`оше, једна по једна, тијесна хим би Ругова, као да тамо вису обешени колачи, дрзну се Хак-Шкрељ.	
Serbian	ни недјеље ни свеца	ни недјеље ни свеца	['41632462483.png', '84415052454.png', '88409239856.png', '15006416308.png', '77522625415.png']	Кад је пролазио поред великог бирцуза, чуло се изнутра лармање момчадије, која је ту сваке недјеље и свеца пила за покрадене ћурке и гуске.	
Serbian	ни недјеље ни свеца	ни недјеље ни свеца	['41632462483.png', '84415052454.png', '88409239856.png', '15006416308.png', '77522625415.png']	Мртвац, сијено и помоћ у невољи, немају ни неђеље ни свеца.	
Serbian	ни недјеље ни свеца	ни недјеље ни свеца	['41632462483.png', '84415052454.png', '88409239856.png', '15006416308.png', '77522625415.png']	"Уочи свакога свеца или недјеље она собом кади све кутове у кући, побожно се крстећи и читајући „оченаш"" и „Богородице ђево""."	
Serbian	ни недјеље ни свеца	ни недјеље ни свеца	['41632462483.png', '84415052454.png', '88409239856.png', '15006416308.png', '77522625415.png']	Чоек сиромах нема ни неђеље ни свеца, тако ти је то.	
Serbian	поглед одозго	поглед одозго	['64953183652.png', '75233874090.png', '14828093970.png', '33396051262.png', '14492454231.png']	Ако трагају за моделима наративног који укрштају структуре обичног живота с изузетним догађајима и поглед одозго с погледом одоздо, историчарима се може препоручити да се окрену фикцијама двадесетог века, укључујући филм (на пример, радови Куросаве, Понтекорва или Јанча).	
Serbian	поглед одозго	поглед одозго	['64953183652.png', '75233874090.png', '14828093970.png', '33396051262.png', '14492454231.png']	Поглед одозго: визуелно  представљање грађана Србије на  Инстаграм профилу председника  Александра Вучића	
Serbian	поглед одозго	поглед одозго	['64953183652.png', '75233874090.png', '14828093970.png', '33396051262.png', '14492454231.png']	Пошав с града уским плећима у северозападноме правцу, долази се на скоро до над саму високу ивицу над Моравом, и вода је овде толико јако у ову страну задрла, да поглед одозго тек дохита ону другу страну воде.	
Serbian	поглед одозго	поглед одозго	['64953183652.png', '75233874090.png', '14828093970.png', '33396051262.png', '14492454231.png']	Разликујемо поглед са предње стране, поглед са бочне стране и поглед одозго.	
Serbian	ићи на спавање пре поноћи	ићи на спавање пре поноћи	['85058524052.png', '78882604272.png', '24262953015.png', '50526594933.png', '10742559292.png']	А како бисмо све ово добили од хормона раста, морамо му омогућити да ради свој посао тиме што ћемо одлазити на спавање пре поноћи, тачније око 22 сата, када је он најактивнији.	
Serbian	ићи на спавање пре поноћи	ићи на спавање пре поноћи	['85058524052.png', '78882604272.png', '24262953015.png', '50526594933.png', '10742559292.png']	Сат пре поноћи треба да већ затече човека у првом сну, а сунце у јутру треба да га пробуди, и рано нам ваља у кревет лећи, рано устати, и тек тако ћемо спавати право и по природи, и устајаћемо потпуно изнутра окрепљени.	
Serbian	пробни камен	пробни камен	['93019681910.png', '59921678411.png', '55680096102.png', '47318441182.png', '92531831767.png']	Другим речима, потражимо, на основу онога што знамо с једне стране о законима интелектуалног живота, а с друге пак о правом циљу наставе, пробни камен, да бисмо могли поуздано разликовати, у погледу наставе, добро и рђаво, боље и горе.	
Serbian	пробни камен	пробни камен	['93019681910.png', '59921678411.png', '55680096102.png', '47318441182.png', '92531831767.png']	Најчешће методе испитивања племенитих метала су: пробни камен, електронички тестер, тест пожара, рендгенска флуоресценција и ултразвук.	
Serbian	пробни камен	пробни камен	['93019681910.png', '59921678411.png', '55680096102.png', '47318441182.png', '92531831767.png']	Последњих неколико година сребрним платнима широм света доминирали су наставци, већ познатих филмова или остварења која изгледају некако недовршено и недоречено, баш као да су пробни камен за неку будућу франшизу.	
Serbian	пробни камен	пробни камен	['93019681910.png', '59921678411.png', '55680096102.png', '47318441182.png', '92531831767.png']	Пробни камен, средство за оцењивање квалитета злата.	
Serbian	скупљати поене	скупљати поене	['31977727548.png', '80166717696.png', '20852303003.png', '44782190340.png', '26076260928.png']	ЕКО Смиле картицама омогућили смо људима да буквално за један динар добију овако нешто, скупљајући поене на нашим пумпама.	
Serbian	скупљати поене	скупљати поене	['31977727548.png', '80166717696.png', '20852303003.png', '44782190340.png', '26076260928.png']	Међу млађом гардом као најамбициознији појавио се владика захумско-херцеговачки Григорије који крупним корацима скупља поене у Патријаршији и делује као кандидат из другог плана.	
Serbian	скупљати поене	скупљати поене	['31977727548.png', '80166717696.png', '20852303003.png', '44782190340.png', '26076260928.png']	Покушао сам да одговорим на разне наградне тестове, а најбоље сам прошао у чувеном тесту „Јесте ли коњ“, али било је читалаца који су скупили више поена.	
Serbian	скупљати поене	скупљати поене	['31977727548.png', '80166717696.png', '20852303003.png', '44782190340.png', '26076260928.png']	У овим, другим по реду скупштинским изборима, политичке партије и коалиције скупљају поене у каткад прегрејаној нациојалистичкој атмосфери.	
Serbian	дрзак као врабац	дрзак као врабац	['75720703474.png', '71790202266.png', '78180269391.png', '88449305180.png', '28235202160.png']	Дрзак као врабац.	
Serbian	дрзак као врабац	дрзак као врабац	['75720703474.png', '71790202266.png', '78180269391.png', '88449305180.png', '28235202160.png']	По пешчаној алеји било је пуно дрских врабаца.	
Serbian	дрзак као врабац	дрзак као врабац	['75720703474.png', '71790202266.png', '78180269391.png', '88449305180.png', '28235202160.png']	Помислио би човјек да једе као врабац, а он дрзак, те узе цијелу тепсију преда се и засука рукаве.	
