language	compound	folder	images	sentence	type pred
Uzbek	quruq gap	quruq gap	['98593705169.png', '69435487363.png', '94553513792.png', '85951379199.png', '95446346807.png']		
Uzbek	soxta ko'z-yoshlar	soxta ko'z-yoshlar	['49549284246.png', '56903014959.png', '10980329918.png', '94778564725.png', '62473855493.png']	U o'tirib olib, rosa soxta ko'z-yosh to'kdi.	
Uzbek	soxta ko'z-yoshlar	soxta ko'z-yoshlar	['49549284246.png', '56903014959.png', '10980329918.png', '94778564725.png', '62473855493.png']	Yetar bas, soxta ko`z yoshlar kerakmas, ishonchim tugab bitdi, bas.	
Uzbek	muammolar o'chog'i	muammolar o'chog'i	['11547959931.png', '51872959090.png', '54022950593.png', '56671379214.png', '39672726048.png']	Har bir mahalla muammolar o‘chog‘i emas, balki islohotlar markazi bo‘lishi kerak, dedi mahalla oqsoqoli.	
Uzbek	muammolar o'chog'i	muammolar o'chog'i	['11547959931.png', '51872959090.png', '54022950593.png', '56671379214.png', '39672726048.png']	Xullas, o‘tgan davr ichida bu mavze, ko‘pchilik kutganidek, obod va ko‘rkam go‘shaga emas, balki muammolar o‘chog‘iga aylandi.	
Uzbek	kelajagi yo'q	kelajagi yo'q	['37506391977.png', '64740791577.png', '71636342893.png', '84256393214.png', '63478817148.png']	Kitob o’qimagan millatning kelajagi yo’q	
Uzbek	kelajagi yo'q	kelajagi yo'q	['37506391977.png', '64740791577.png', '71636342893.png', '84256393214.png', '63478817148.png']	Porsche Cayenne mashinam bor, lekin u yerda kelajagim yo‘q	
Uzbek	yettinchi osmonda	yettinchi osmonda	['11833704721.png', '49445971606.png', '21485405968.png', '14862382559.png', '63581037041.png']	Garchi, bu kamtarona taklif bo‘lsa-da, Tigana omadi chopganidan yettinchi osmonda edi.	
Uzbek	yettinchi osmonda	yettinchi osmonda	['11833704721.png', '49445971606.png', '21485405968.png', '14862382559.png', '63581037041.png']	Ha, xursandligimdan yettinchi osmonda uchib yurgandek bo‘ldim.	
Uzbek	pirovard natija	pirovard natija	['44724166183.png', '52262290340.png', '97203046375.png', '41427862417.png', '20083508596.png']	Bundan ko‘zlangan pirovard natija iqtisodiyotda soliq yukini pasaytirish orqali raqobatbardoshlikni oshirish va investitsiyalarni jalb etishga imkoniyat yaratishdir.	
Uzbek	pirovard natija	pirovard natija	['44724166183.png', '52262290340.png', '97203046375.png', '41427862417.png', '20083508596.png']	Lekin, afsuski, birgina xohish bilan biz yuqori hosildorlikka va pirovard natijaga erisha olmaymiz.	
Uzbek	tosh yurak	tosh yurak	['71072176625.png', '20772045604.png', '68380241607.png', '15801814034.png', '77960175060.png']		
Uzbek	ishtiyoqi baland	ishtiyoqi baland	['54268454048.png', '71108710093.png', '34353465720.png', '76362031426.png', '16981263598.png']	Film tomosha qilishga unchalik ishtiyoqim baland emas.	
Uzbek	ishtiyoqi baland	ishtiyoqi baland	['54268454048.png', '71108710093.png', '34353465720.png', '76362031426.png', '16981263598.png']	Suyagi mehnatda qotgan suhbatdoshimiz dadasidan o‘rganganlari va yillar davomida to‘plagan tajribasini ishsiz, tadbirkorlikka ishtiyoqi baland yoshlarga o‘rgatish maqsadida bir qancha loyihalarga qo‘l urgan.	
Uzbek	arzimagan pul	arzimagan pul	['22108358848.png', '33044337714.png', '12027109520.png', '51479201318.png', '88651037929.png']	Ishchilarga mehnatiga arzimagan pul berilsa, ular ishni shunga yarasha sifatsiz qilishi tabiiy.	
Uzbek	arzimagan pul	arzimagan pul	['22108358848.png', '33044337714.png', '12027109520.png', '51479201318.png', '88651037929.png']	Mehnatimga arzimagan pul berishingizga noroziman.	
Uzbek	arzimagan pul	arzimagan pul	['22108358848.png', '33044337714.png', '12027109520.png', '51479201318.png', '88651037929.png']	Nahotki, bola qadri shu arzimagan pul bilan o‘lchansa.	
Uzbek	arzimagan pul	arzimagan pul	['22108358848.png', '33044337714.png', '12027109520.png', '51479201318.png', '88651037929.png']	Yeganimizcha yeb, qolganini arzimagan pulga sotardik yoki mollarga berardik.	
Uzbek	karami keng	karami keng	['25438933992.png', '16127732542.png', '58820170736.png', '83301030217.png', '84699809315.png']		
Uzbek	birdaniga tashlamoq	birdaniga tashlamoq	['23928568139.png', '17974909376.png', '50103299901.png', '58279667171.png', '12192732090.png']	Chekishni birdaniga tashlagandan so‘ng dastlabki o‘zgarishlar bir necha daqiqa ichida boshlanadi.	
Uzbek	birdaniga tashlamoq	birdaniga tashlamoq	['23928568139.png', '17974909376.png', '50103299901.png', '58279667171.png', '12192732090.png']	Chekishni birdaniga tashlamoqchi bo‘lgan insonlarda organizm uzoq vaqt kurashadi va nikotin talab qiladi.	
Uzbek	birdaniga tashlamoq	birdaniga tashlamoq	['23928568139.png', '17974909376.png', '50103299901.png', '58279667171.png', '12192732090.png']	Onasi unga axlatni birdaniga tashla, deb buyruq berdi.	
Uzbek	birdaniga tashlamoq	birdaniga tashlamoq	['23928568139.png', '17974909376.png', '50103299901.png', '58279667171.png', '12192732090.png']	U qo'lidagi qog'ozni birdaniga tashladi.	
Uzbek	katta odam 3 → big wig	katta odam 3 → big wig	['95487307632.png', '65096101704.png', '44567036853.png', '76697371818.png', '76869366687.png']		
Uzbek	paxta qo'ymoq	paxta qo'ymoq	['21975827155.png', '11214160778.png', '85820628333.png', '71912488478.png', '54808023912.png']	Buning asosiy sababi real ish qolib, ko‘p sohada xo‘jako‘rsinga ishlash, kattalarga “paxta qo‘yish” bilan vaqt o‘tkazayotganimiz.	
Uzbek	paxta qo'ymoq	paxta qo'ymoq	['21975827155.png', '11214160778.png', '85820628333.png', '71912488478.png', '54808023912.png']	Menga bunaqa paxta qo‘yishlar kerak emas! – deb na’ra tortadi.	
Uzbek	paxta qo'ymoq	paxta qo'ymoq	['21975827155.png', '11214160778.png', '85820628333.png', '71912488478.png', '54808023912.png']	Paxtani qo'y,  bu yerdan so'roqsiz  paxta olib ketish mumkin emas.	
Uzbek	paxta qo'ymoq	paxta qo'ymoq	['21975827155.png', '11214160778.png', '85820628333.png', '71912488478.png', '54808023912.png']	U kecha olgan paxtani omborxonaga qo'ydi.	
Uzbek	mehnatkash chumoli	mehnatkash chumoli	['21431986145.png', '48685372144.png', '35222567636.png', '73172203682.png', '15331541855.png']	"Bernardu Silva — yuqori texnikaga ega, shu bilan birga ""mehnatkash chumoli""."	
Uzbek	mehnatkash chumoli	mehnatkash chumoli	['21431986145.png', '48685372144.png', '35222567636.png', '73172203682.png', '15331541855.png']	Chumoli, mehnatkash chumoli, kuyinma, atrofga bir qara maysalar, oh, qanday himoli, dunyoni qilma ko‘p masxara.	
Uzbek	mehnatkash chumoli	mehnatkash chumoli	['21431986145.png', '48685372144.png', '35222567636.png', '73172203682.png', '15331541855.png']	Qadim zamonda bir mehnatkash chumoli bo'lgan ekan.	
Uzbek	mehnatkash chumoli	mehnatkash chumoli	['21431986145.png', '48685372144.png', '35222567636.png', '73172203682.png', '15331541855.png']	U mehnatkash chumolidek tinim bilmay ishlar edi.	
Uzbek	o'zining tomorqasidan tashqarida	o'zining tomorqasidan tashqarida	['84868855526.png', '80845749332.png', '64883397075.png', '28186296063.png', '33875489966.png']	Bolaligidan o‘zining tomorqasidan tashqariga kam chiqadigan, uy ishlarini yaxshi ko‘radigan bola edi.	
Uzbek	o'zining tomorqasidan tashqarida	o'zining tomorqasidan tashqarida	['84868855526.png', '80845749332.png', '64883397075.png', '28186296063.png', '33875489966.png']	Notanish muhitda u o‘zining tomorqasidan tashqarida bo‘lgandek, noqulay va ishonchsiz harakat qildi.	
Uzbek	o'zining tomorqasidan tashqarida	o'zining tomorqasidan tashqarida	['84868855526.png', '80845749332.png', '64883397075.png', '28186296063.png', '33875489966.png']	U butun kunni o‘zining tomorqasidan tashqarida ishlamay, daraxt ekish bilan o‘tkazadi.	
Uzbek	o'zining tomorqasidan tashqarida	o'zining tomorqasidan tashqarida	['84868855526.png', '80845749332.png', '64883397075.png', '28186296063.png', '33875489966.png']	U yangi ish boshlaganda o‘zini o‘zining tomorqasidan tashqarida his qildi — hamma narsa begona tuyuldi.	
Uzbek	ruhi tushmoq	ruhi tushmoq	['65549796151.png', '24952256604.png', '11036927656.png', '83451666503.png', '29264384358.png']	Bu gal omadi kelmagan sportchilarimizga qarata, ruhingiz tushmasin, kelgusi safar baxt sizlarga albatta kulib boqadi, deb ishonch bildirmoqchiman.	
Uzbek	ruhi tushmoq	ruhi tushmoq	['65549796151.png', '24952256604.png', '11036927656.png', '83451666503.png', '29264384358.png']	U shunday dedi-yu, juda yaqin kishisidan judo bo‘lgandek, ruhi tushib ketdi.	
Uzbek	bir tiyinga qimmat	bir tiyinga qimmat	['99867314090.png', '18449543971.png', '51555489534.png', '76659283905.png', '41869262197.png']	Biroq men aminmanki, Vladimir bu gaplar bir tiyinga qimmat ekanini isbotlashga tayyor.	
Uzbek	bir tiyinga qimmat	bir tiyinga qimmat	['99867314090.png', '18449543971.png', '51555489534.png', '76659283905.png', '41869262197.png']	Bu olmalar chirigan, bir tiyinga qimmat, arzonroq qiling, ikki kilosini bir tiyinga bering, dedi xaridor.	
Uzbek	bir tiyinga qimmat	bir tiyinga qimmat	['99867314090.png', '18449543971.png', '51555489534.png', '76659283905.png', '41869262197.png']	Kecha men olgan nok bir tiyinga qimmat ekan, sotib olganimdan so'ng, undan arzonrog'i chiqib qolsa deng.	
Uzbek	bir tiyinga qimmat	bir tiyinga qimmat	['99867314090.png', '18449543971.png', '51555489534.png', '76659283905.png', '41869262197.png']	Mana shunaqa mantiqsiz she’rlardan bir tiyinga qimmat qo‘shiqlar yuzaga kelayotir	
Uzbek	bir-biriga aybni to'nkamoq	bir-biriga aybni to'nkamoq	['59444285845.png', '66334439826.png', '16379741140.png', '63081156815.png', '97064093651.png']	Odam xom sut emgan bandada, bir joyda yolg‘on gapirishi mumkin, yomon ko‘rgan odamiga qo‘shimcha ayb to‘nkashi mumkin.	
Uzbek	bir-biriga aybni to'nkamoq	bir-biriga aybni to'nkamoq	['59444285845.png', '66334439826.png', '16379741140.png', '63081156815.png', '97064093651.png']	Orif yolgʻonchilik qilib, ham-ma aybni menga toʻnkagani uchun sal boʻlmasa yigʻlavoray dedim.	
Uzbek	bir balodan qolmoq	bir balodan qolmoq	['92689354082.png', '18276394117.png', '31668480975.png', '41033222197.png', '67607257841.png']	Bozorda mashina yonib ketay deganda, u zo‘rg‘a qochib, bir balodan qoldi.	
Uzbek	bir balodan qolmoq	bir balodan qolmoq	['92689354082.png', '18276394117.png', '31668480975.png', '41033222197.png', '67607257841.png']	Daraxtdan shox uzayotgan paytda qulab tushay dedi, lekin arqon ushlab qolib, bir balodan qoldi.	
Uzbek	ona tili	ona tili	['70885676038.png', '22126602809.png', '17079820526.png', '72030824814.png', '59308373500.png']		
Uzbek	sut tishi	sut tishi	['52239671564.png', '66065921111.png', '12158251264.png', '48279263284.png', '21606464961.png']		
Uzbek	bir bahya qolmoq	bir bahya qolmoq	['86713532715.png', '10144526077.png', '27551322557.png', '25897399841.png', '75288805245.png']	Bir baxya ham suvli yerlar boʻsh qolmasin.	
Uzbek	bir bahya qolmoq	bir bahya qolmoq	['86713532715.png', '10144526077.png', '27551322557.png', '25897399841.png', '75288805245.png']	Oyogʻim uzilib, jagʻim osilib tushishiga bir baxya qoldi.	
Uzbek	bir bahya qolmoq	bir bahya qolmoq	['86713532715.png', '10144526077.png', '27551322557.png', '25897399841.png', '75288805245.png']	Oʻlishimga bir baxya qoldi.	
Uzbek	bir bahya qolmoq	bir bahya qolmoq	['86713532715.png', '10144526077.png', '27551322557.png', '25897399841.png', '75288805245.png']	Shunday yoshlarimizning ishini eshitganda, kishining koʻngli yana bir baxya koʻtarilib, koʻngling quvonchga toʻladi.	
Uzbek	bir o'q bilan ikki quyonni urmoq	bir o'q bilan ikki quyonni urmoq	['33853179834.png', '68203637411.png', '79782935710.png', '69499987535.png', '63527120465.png']		
Uzbek	ilg'or rivojlanish	ilg'or rivojlanish	['47677986947.png', '66381888071.png', '46392212333.png', '79096630370.png', '74711850054.png']	2017 yilda Asqar Akayev va uning qizi Bermet muallifligida respublika kelajagi haqidagi “Qirg‘izistonning ilg‘or rivojlanish strategiyasi” kitobi taqdim etildi.	
Uzbek	ilg'or rivojlanish	ilg'or rivojlanish	['47677986947.png', '66381888071.png', '46392212333.png', '79096630370.png', '74711850054.png']	Bu, o‘z navbatida, ilg‘or rivojlanadigan demokratik davlatni barpo etishga ko‘maklashadi.	
Uzbek	nazarga ilmaslik	nazarga ilmaslik	['60994353181.png', '98468253908.png', '87454962178.png', '75238871531.png', '33597654409.png']	Inson yaxshi tarbiya ko‘rmagan va turmushda tajriba orttirmagan bo‘lsa, u ko‘p narsalarni nazarga ilmaydi va undan jirkanadi.	
Uzbek	nazarga ilmaslik	nazarga ilmaslik	['60994353181.png', '98468253908.png', '87454962178.png', '75238871531.png', '33597654409.png']	Uncha-muncha ovqatni nazari ilmaydi: osh, do‘lma, manti-yu qazidan gapiradi.	
Uzbek	xamirdan qil sug'urganday	xamirdan qil sug'urganday	['76779745082.png', '86902004411.png', '18522607566.png', '19569458882.png', '54091011699.png']		
Uzbek	beqaror mamlakat	beqaror mamlakat	['50063955154.png', '18721821668.png', '31453250739.png', '25019476515.png', '96979245373.png']	2021 yil may oyida Malida harbiy to‘ntarish sodir bo‘lganidan beri, Afrikadagi juda beqaror mamlakat Rossiya va jangchilari mamlakatda «harbiy maslahatchilar» deb ataladigan Vagner guruhi bilan yaqin aloqada bo‘lgan harbiy xunta tomonidan boshqariladi.	
Uzbek	beqaror mamlakat	beqaror mamlakat	['50063955154.png', '18721821668.png', '31453250739.png', '25019476515.png', '96979245373.png']	Erishilgan kelishuvlarga qaramay Yaman beqaror mamlakatligicha qolmoqda.	
Uzbek	katta odam 1 → big fish	katta odam 1 → big fish	['87610897540.png', '79246987606.png', '46781440754.png', '59651190501.png', '93537329638.png']		
Uzbek	turmush qurmoq	turmush qurmoq	['38621504457.png', '34119753227.png', '48591321291.png', '76901717053.png', '33506022678.png']		
Uzbek	eski gap	eski gap	['19801596184.png', '99717802197.png', '93376785077.png', '60663030726.png', '14557766778.png']	Har safar ko'rishib qolganimizda u  eski gapni, ya'ni men qilgan xatoni qayta va qayta eslatadi.	
Uzbek	eski gap	eski gap	['19801596184.png', '99717802197.png', '93376785077.png', '60663030726.png', '14557766778.png']	Ikki do'stning bahsi yana eski gapdan,ya'ni pul masalasidagi kelishmovchilikdan boshlandi.	
Uzbek	tirriq buzoq	tirriq buzoq	['46157199031.png', '75058565937.png', '56166268135.png', '46119799164.png', '86868362830.png']	Boshqa tarafdan olib qaraganda, bitta tirraqi buzoq butun podani buzadi degan gap bor.	
Uzbek	tirriq buzoq	tirriq buzoq	['46157199031.png', '75058565937.png', '56166268135.png', '46119799164.png', '86868362830.png']	Hamma oʻlib-tirilib ishlab yursa-yu, bir tirraqi buzoq podani bulgʻasa, hali koʻra-san, buning isnodi butun brigadaga tegadi	
Uzbek	tirriq buzoq	tirriq buzoq	['46157199031.png', '75058565937.png', '56166268135.png', '46119799164.png', '86868362830.png']	Og'ilda ikki tirriq buzoq va bir sigir bor edi.	
Uzbek	tirriq buzoq	tirriq buzoq	['46157199031.png', '75058565937.png', '56166268135.png', '46119799164.png', '86868362830.png']	Shodiyor mol bozorga chiqib, bitta tirriq buzoq bo'lsa ham sotib olishga had qildi.	
Uzbek	bir burda non	bir burda non	['83947750783.png', '61861632215.png', '24184061734.png', '33264419787.png', '64944481101.png']	Bir burda non bir kunga hamdam.	
Uzbek	bir burda non	bir burda non	['83947750783.png', '61861632215.png', '24184061734.png', '33264419787.png', '64944481101.png']	Har kuni go‘sht yemasak ham, bir burda nonga ham qorin to‘yaveradi.	
Uzbek	bir burda non	bir burda non	['83947750783.png', '61861632215.png', '24184061734.png', '33264419787.png', '64944481101.png']	Mehnatkash bo‘lsalaring hamisha bir burda nonlaringni topib yeysizlar.	
Uzbek	bir burda non	bir burda non	['83947750783.png', '61861632215.png', '24184061734.png', '33264419787.png', '64944481101.png']	U o‘ziga bir burda non topish maqsadida soatlab sabzavot va mevalar uchun savat to‘qirdi.	
Uzbek	olovga benzin sepmoq	olovga benzin sepmoq	['13571598913.png', '23815451448.png', '31464338077.png', '38233487840.png', '81498975495.png']	Bola o‘ynab yurib, olovga benzin sepib yubordi va katta alangalanish yuz berdi.	
Uzbek	olovga benzin sepmoq	olovga benzin sepmoq	['13571598913.png', '23815451448.png', '31464338077.png', '38233487840.png', '81498975495.png']	Do‘stining g‘azablangan paytida kinoya bilan gapirish — bu holatda olovga benzin sepish bilan barobar edi.	
Uzbek	olovga benzin sepmoq	olovga benzin sepmoq	['13571598913.png', '23815451448.png', '31464338077.png', '38233487840.png', '81498975495.png']	Ishchilar ehtiyotsizlik bilan olovga benzin sepganlari sababli yong‘in chiqdi.	
Uzbek	olovga benzin sepmoq	olovga benzin sepmoq	['13571598913.png', '23815451448.png', '31464338077.png', '38233487840.png', '81498975495.png']	Ularning janjaliga aralashib, salom aytgan odam olovga benzin sepgan bo‘ldi — bahs yanada kuchaydi.	
Uzbek	adolat bilan yondashuv	adolat bilan yondashuv	['45735886666.png', '50901078815.png', '94609322344.png', '68265834610.png', '51058100577.png']	Jurnalistikaning asosini azaldan xolislik, faqat haqiqatni gapirish, yozish, fikr yuritilayotgan mavzuga adolat bilan yondashish tashkil etadi.	
Uzbek	adolat bilan yondashuv	adolat bilan yondashuv	['45735886666.png', '50901078815.png', '94609322344.png', '68265834610.png', '51058100577.png']	Lekin onalarning mehnatlari odatda soyada qoladi, shuning uchun adolat bilan yondashgan holda taniqli shaxslarning onalari haqidagi maqolani e’tiboringizga havola etamiz.	
Uzbek	bosh og'rig'i	bosh og'rig'i	['11565265624.png', '44928524699.png', '61736897846.png', '91540163673.png', '31448297147.png']		
Uzbek	bir tiyin bo'lmoq	bir tiyin bo'lmoq	['42103463446.png', '18338284661.png', '98793059788.png', '87094241840.png', '57297499184.png']		
Uzbek	yashirin iste'dod	yashirin iste'dod	['44737276012.png', '66836306174.png', '72354980999.png', '97630668766.png', '47154594133.png']	Elektron musiqa vakillari orasida yashirin iste’dodlarni izlash va topish asosiy vazifalardan biridir.	
Uzbek	yashirin iste'dod	yashirin iste'dod	['44737276012.png', '66836306174.png', '72354980999.png', '97630668766.png', '47154594133.png']	Shuningdek xodimlarning kompetensiyalarini baholash ham amalga oshiriladi, bu baholashdan ko‘zlangan maqsad bir tomondan kompaniyadagi mavjud inson resurslarini aniqlash va ulardan unumli foydalanish va boshqa tomondan xodimlarning yashirin iste’dodlarini aniqlashdir.	
Uzbek	og'ir oyoq	og'ir oyoq	['70484253990.png', '20777774089.png', '72330157999.png', '50698905973.png', '92374767855.png']	Bu orada og‘iroyoq kelinning ko‘zi yoridi.	
Uzbek	og'ir oyoq	og'ir oyoq	['70484253990.png', '20777774089.png', '72330157999.png', '50698905973.png', '92374767855.png']	Malika ertalab bozordan har biri 1 kilodan keladigan 2 ta tozalangan og'ir oyoq sotib oldi.	
Uzbek	og'ir oyoq	og'ir oyoq	['70484253990.png', '20777774089.png', '72330157999.png', '50698905973.png', '92374767855.png']	Og‘iroyoq kelinni ona kuzatdi.	
Uzbek	og'ir oyoq	og'ir oyoq	['70484253990.png', '20777774089.png', '72330157999.png', '50698905973.png', '92374767855.png']	Ushbu taomni tayyorlash uchun bizga 1 ta molning og'ir oyog'i, sabzavotlar hamda ziravorlar kerak bo'ladi.	
Uzbek	xom xayol	xom xayol	['93183867587.png', '44704816916.png', '77841376347.png', '98472176025.png', '85662758769.png']		
Uzbek	ko'ngli bo'sh	ko'ngli bo'sh	['41744434939.png', '87515005657.png', '52926105722.png', '64384235811.png', '69460727352.png']	Atrofdagilar esa uni ko‘ngli bo‘sh, yumshoqlikda ayblashadi.	
Uzbek	ko'ngli bo'sh	ko'ngli bo'sh	['41744434939.png', '87515005657.png', '52926105722.png', '64384235811.png', '69460727352.png']	Homiladorlik davrida odam juda ko‘ngli bo‘sh bo‘lib qolarkan.	
Uzbek	tajriba quyonchasi	tajriba quyonchasi	['60092982353.png', '70667970265.png', '61323582533.png', '41221457820.png', '66922223302.png']		
Uzbek	katta odam 2 → big сheese	katta odam 2 → big сheese	['10158338290.png', '48304462125.png', '68955722183.png', '89853431565.png', '58079270737.png']		
Uzbek	siyqasi chiqqan	siyqasi chiqqan	['21322243891.png', '42180672815.png', '63626063439.png', '86517089493.png', '55001028089.png']		
Uzbek	qo'li egri	qo'li egri	['90567596496.png', '75658970136.png', '42498499026.png', '74000403062.png', '99659544936.png']		
Uzbek	tug'ruqdan keyingi tushkunlik	tug'ruqdan keyingi tushkunlik	['41164939953.png', '50241418747.png', '77745983347.png', '11972575591.png', '13432657194.png']	Dilafruz tug‘ruqdan keyin o‘zini yomon his qilib, tug‘ruqdan keyingi tushkunlik davrini boshdan o‘tkazdi.	
Uzbek	tug'ruqdan keyingi tushkunlik	tug'ruqdan keyingi tushkunlik	['41164939953.png', '50241418747.png', '77745983347.png', '11972575591.png', '13432657194.png']	Shifokor aytishicha, ayrim ayollar tug‘ruqdan keyingi tushkunlik holatini boshdan kechiradi.	
Uzbek	xom semiz	xom semiz	['19292136922.png', '12744706124.png', '75259502474.png', '69596908947.png', '77117824230.png']	Endi Joshuani barcha o‘sha kichkina xomsemizga mag‘lub bo‘lgan bokschi sifatida ko‘radi	
Uzbek	xom semiz	xom semiz	['19292136922.png', '12744706124.png', '75259502474.png', '69596908947.png', '77117824230.png']	Yurolmaydi bularning hammasi, xomsemiz bo‘lib qolgan.	
Uzbek	qora bozor	qora bozor	['65143029989.png', '13937990526.png', '59378403911.png', '84611562582.png', '72945069597.png']	Agar ushbu taqiqlangan yuk manzilga yetib borganda edi, qora bozorda 800 million yevroga pullangan bo‘lardi”, – deyiladi xabarda.	
Uzbek	qora bozor	qora bozor	['65143029989.png', '13937990526.png', '59378403911.png', '84611562582.png', '72945069597.png']	"Ahmad o'zi ochgan yangi do'konining fasadi qora rangda bo'lgani uchun unga ""qora bozor"" deb nom beribdi."	
Uzbek	qora bozor	qora bozor	['65143029989.png', '13937990526.png', '59378403911.png', '84611562582.png', '72945069597.png']	Bozorning atrofi qora rangli baland devor bilan o'ralgani uchun uni qora bozor deb atashardi.	
Uzbek	qora bozor	qora bozor	['65143029989.png', '13937990526.png', '59378403911.png', '84611562582.png', '72945069597.png']	Ushbu qimmatbaho topilmalar chet eldagi xorijiy kolleksiyalarga yuborilgan yoki arxeologlar qora bozorga chiqarib, pullab yuborgan.	
Uzbek	biologik soat	biologik soat	['53687176255.png', '21565310944.png', '39277895897.png', '52073337532.png', '55635324795.png']	Ayniqsa, qushlarda biologik soat hissi juda nozik boʻladi.	
Uzbek	biologik soat	biologik soat	['53687176255.png', '21565310944.png', '39277895897.png', '52073337532.png', '55635324795.png']	Biologik soat ayniqsa hayvonlar va parrandalarda yaqqol namoyon boʻladi.	
Uzbek	biologik soat	biologik soat	['53687176255.png', '21565310944.png', '39277895897.png', '52073337532.png', '55635324795.png']	Har bir ayol o‘z biologik soatini his qilib, farzand ko‘rishni juda kechga qoldirmasligi kerak.	
Uzbek	biologik soat	biologik soat	['53687176255.png', '21565310944.png', '39277895897.png', '52073337532.png', '55635324795.png']	Yoshi o‘tib borar ekan, u ich-ichidan biologik soati “ishlayotganini” sezdi.	
Uzbek	ko'zini moshdek ochmoq	ko'zini moshdek ochmoq	['42808204143.png', '89801878410.png', '43103006663.png', '84677103218.png', '22031587227.png']	Bola qo‘rqib ketganidan ko‘zini moshdek ochib, jim turib qoldi.	
Uzbek	ko'zini moshdek ochmoq	ko'zini moshdek ochmoq	['42808204143.png', '89801878410.png', '43103006663.png', '84677103218.png', '22031587227.png']	Mana bugungi majlis ko‘zimni moshdek ochdi.	
Uzbek	ko'zini moshdek ochmoq	ko'zini moshdek ochmoq	['42808204143.png', '89801878410.png', '43103006663.png', '84677103218.png', '22031587227.png']	Shoshmay turing, ko‘zingizni moshday ochib qo‘yganimda bilasiz!	
Uzbek	ko'zini moshdek ochmoq	ko'zini moshdek ochmoq	['42808204143.png', '89801878410.png', '43103006663.png', '84677103218.png', '22031587227.png']	U filmning eng hayajonli joyida ko‘zini moshdek ochib ekranga tikilib qoldi.	
Uzbek	uchar likobcha	uchar likobcha	['97321925098.png', '31941521442.png', '59401908459.png', '35944560651.png', '83985866152.png']		
Uzbek	oq suyak	oq suyak	['78855658627.png', '22752529095.png', '97325074002.png', '12998126771.png', '66700512235.png']	Badavlat oqsuyaklar oilasida tug‘ilgan Tildaning ota-onasi qizini 10 yoshga to‘lganida Kentdagi maktab-internatga yuborgan.	
Uzbek	oq suyak	oq suyak	['78855658627.png', '22752529095.png', '97325074002.png', '12998126771.png', '66700512235.png']	Haqiqatan ham u oqsuyak nasabli, demokratiya va respublika tuzumi tarafdori bo‘lishiga qaramasdan, qirollik saroyining eng latif odatlari, odobini o‘zida mujassam etgandi.	
Uzbek	oq suyak	oq suyak	['78855658627.png', '22752529095.png', '97325074002.png', '12998126771.png', '66700512235.png']	Otlar bilan bog‘liq musobaqalar, kurash, oq suyak kabi o‘yinlar shular jumlasidan.	
Uzbek	oq suyak	oq suyak	['78855658627.png', '22752529095.png', '97325074002.png', '12998126771.png', '66700512235.png']	Ramazon boshlandi deguncha Badaxshon qishlog‘ining har kuni “Oq suyak”, “Chavandoz va egarchi” o‘ynaydigan o‘g‘il bolalari tutumlarini o‘zgartiradilar.	
Uzbek	sevgi uchburchagi	sevgi uchburchagi	['95602176108.png', '26694773152.png', '42580270593.png', '30567336177.png', '89493262025.png']		
Uzbek	abadiy uyqu	abadiy uyqu	['93369316090.png', '65405884201.png', '99566925893.png', '44915055970.png', '82231959871.png']	Keyin kabinaga qaytib, yotadi va abadiy uyquga ketadi	
Uzbek	abadiy uyqu	abadiy uyqu	['93369316090.png', '65405884201.png', '99566925893.png', '44915055970.png', '82231959871.png']	Ostonaga bosh qo‘yganicha abadiy uyquga ketgan yosh juvonning tepasida olti yashar o‘g‘ilchasi Xisrav yig‘lab turar, hali o‘lim nimaligini bilmaydigan bechora bola nuqul onasini uyg‘otmoqchi bo‘lardi.	
Uzbek	sirni ochmoq	sirni ochmoq	['76782114284.png', '14073354013.png', '51849867029.png', '49728732304.png', '67275026083.png']		
Uzbek	shirin paxta	shirin paxta	['40086242442.png', '79368873040.png', '65541586190.png', '28550763657.png', '16494927710.png']	Jajji bolajonlar uchun esa mazali pop-korn va shirin paxtalar ulashildi.	
